{
  "schema_name": "macos-local-vm-release-identity-contract",
  "schema_version": "1.0.0",
  "contract_id": "iar-macos-local-vm-release-identity-2026-09-01.1",
  "contract_state": "source-free-unmaterialized-candidate-contract",
  "repository": "tdloB/impresari-context",
  "contract_baseline_revision": "f160c2042c287d0a7188f16516610b21711db8d4",
  "product_version": "0.2.0",
  "target_platform": "macos",
  "target_architecture": "arm64",
  "rust_target": "aarch64-apple-darwin",
  "rust_toolchain": "1.98.0",
  "package_contract_id": "iar-macos-local-vm-cask-contract-2026-09-01.1",
  "package_contract_digest": "sha256:4f249a15c1cd0b5283c937d49cc1888c3ab56b2a9a22847b8913901c72d5f676",
  "guest_release_id": "iar-macos-local-vm-guest-2026-08-31.1",
  "guest_metadata_set_digest": "sha256:ea29c43f36493f7e61935f33a64822805c8275d804c5384c3e8becea849fc54b",
  "guest_metadata_seal_digest": "sha256:c0294a88c2c7fe1d33bdd8ddfbb55e26e6595f02c12a9645c898f36148aa82e1",
  "source_set_canonicalization": "path-tab-bytes-tab-prefixed-sha256-lf-v1",
  "source_set_digest": "sha256:d5e98d46ba5294f147bdd44a5eb8fb307247472f69b9fed0b482f33feeef733e",
  "source_inputs": [
    {"path": "Cargo.lock", "bytes": "44576", "sha256": "sha256:d04f92d689b5d92fba1b49442258b9db82c0f141f07bc3b45dd04b6883278add", "role": "locked-rust-dependency-graph"},
    {"path": "Cargo.toml", "bytes": "1303", "sha256": "sha256:6af9bfdea9bb32b0240b1989bcf43a511f566a6572c6e6b749bda57800231a6a", "role": "workspace-release-version-and-members"},
    {"path": "LICENSE", "bytes": "11357", "sha256": "sha256:c71d239df91726fc519c6eb72d318ec65820627232b2f796219e87dcf35d0ab4", "role": "product-license"},
    {"path": "crates/context-cli/Cargo.toml", "bytes": "1791", "sha256": "sha256:2565ad3ea2f55a0f2dd5d4eb340efa3a25780ff46c244294152fdd61951751c9", "role": "cli-package-manifest"},
    {"path": "crates/context-cli/src/main.rs", "bytes": "339", "sha256": "sha256:088976c16c5314efb036403c9c80e354e37eb5dc56f6329f65e4dc7e019b1294", "role": "cli-entrypoint"},
    {"path": "crates/context-mcp/Cargo.toml", "bytes": "947", "sha256": "sha256:d3419b67488e25ea0b669a57b27e07a936740363ed54a2e158987981ccb653c6", "role": "mcp-package-manifest"},
    {"path": "crates/context-mcp/src/main.rs", "bytes": "6773", "sha256": "sha256:096e2375fba9849e522b9d93c5de82005ba6ddfcfb42e4515616c7aae4f4c2d1", "role": "mcp-entrypoint"},
    {"path": "crates/context-structural/Cargo.toml", "bytes": "2293", "sha256": "sha256:28f8a9805f9df6f6b3871c243b09ae9e8a9d975c8584b5cbbd7ae4436bc1df0f", "role": "structural-worker-package-manifest"},
    {"path": "crates/context-structural/src/main.rs", "bytes": "234", "sha256": "sha256:db8ae4a3c6ae544ded05cf5a8d94a054350aa4cfac0d339885f223cf37d73b6c", "role": "structural-worker-entrypoint"},
    {"path": "platform/macos-vm-feasibility/Resources/Controller.entitlements", "bytes": "249", "sha256": "sha256:5c1c6753b84cc1a1349de2a465074f166b5a47bade536b231683c22f53072259", "role": "future-controller-signing-entitlements"},
    {"path": "platform/macos-vm-feasibility/Sources/Controller/main.swift", "bytes": "33703", "sha256": "sha256:777c29af52ef823c4f24d852526c62af236dbc880a74de69de8e4ad7baac92f6", "role": "vm-controller-entrypoint"},
    {"path": "platform/macos-vm-feasibility/cask-package-contract-v1.json", "bytes": "3623", "sha256": "sha256:4f249a15c1cd0b5283c937d49cc1888c3ab56b2a9a22847b8913901c72d5f676", "role": "closed-bundle-role-contract"},
    {"path": "platform/macos-vm-feasibility/guest-release-metadata-seal-v1.json", "bytes": "5947", "sha256": "sha256:c0294a88c2c7fe1d33bdd8ddfbb55e26e6595f02c12a9645c898f36148aa82e1", "role": "closed-guest-release-metadata"},
    {"path": "rust-toolchain.toml", "bytes": "86", "sha256": "sha256:495c69d1db93f25f53e3d0d2d40d812313366cc368de317871c2ace6c6ffafa4", "role": "rust-toolchain-pin"},
    {"path": "scripts/build-macos-vm-feasibility.sh", "bytes": "2950", "sha256": "sha256:79aca92d02ab6c23130db9828c9032090a3c59e2739e087148e4562a2d28ea96", "role": "synthetic-guest-and-controller-build-reference"}
  ],
  "build_units": [
    {
      "unit_id": "cli-supervisor-entrypoint",
      "bundle_path": "Contents/MacOS/impresari-context",
      "artifact_kind": "mach-o-arm64-executable",
      "build_system": "cargo",
      "command": ["cargo", "build", "--locked", "--release", "--target", "aarch64-apple-darwin", "-p", "context-cli", "--bin", "impresari-context"],
      "unsigned_output": "target/aarch64-apple-darwin/release/impresari-context",
      "candidate_identity": "required-at-candidate-build"
    },
    {
      "unit_id": "local-stdio-mcp-server",
      "bundle_path": "Contents/Helpers/impresari-context-mcp",
      "artifact_kind": "mach-o-arm64-executable",
      "build_system": "cargo",
      "command": ["cargo", "build", "--locked", "--release", "--target", "aarch64-apple-darwin", "-p", "context-mcp", "--bin", "impresari-context-mcp"],
      "unsigned_output": "target/aarch64-apple-darwin/release/impresari-context-mcp",
      "candidate_identity": "required-at-candidate-build"
    },
    {
      "unit_id": "isolated-structural-worker",
      "bundle_path": "Contents/Helpers/impresari-context-structural-worker",
      "artifact_kind": "mach-o-arm64-executable",
      "build_system": "cargo",
      "command": ["cargo", "build", "--locked", "--release", "--target", "aarch64-apple-darwin", "-p", "context-structural", "--bin", "impresari-context-structural-worker"],
      "unsigned_output": "target/aarch64-apple-darwin/release/impresari-context-structural-worker",
      "candidate_identity": "required-at-candidate-build"
    },
    {
      "unit_id": "local-vm-controller",
      "bundle_path": "Contents/Helpers/impresari-context-vm-controller",
      "artifact_kind": "mach-o-arm64-executable",
      "build_system": "xcrun-swiftc",
      "command": ["xcrun", "swiftc", "-swift-version", "5", "-O", "-module-cache-path", "{ephemeral_module_cache}", "-framework", "Virtualization", "-framework", "CryptoKit", "-framework", "AppKit", "-o", "{unsigned_output}", "platform/macos-vm-feasibility/Sources/Controller/main.swift"],
      "unsigned_output": "target/iar-macos-vm-release/bin/impresari-context-vm-controller",
      "candidate_identity": "required-at-candidate-build"
    },
    {
      "unit_id": "closed-guest-payload-root",
      "bundle_path": "Contents/Resources/macos-vm/guest",
      "artifact_kind": "metadata-sealed-guest-payload-set",
      "build_system": "separate-authenticated-guest-candidate",
      "command": ["not-authorized-by-adr-0109"],
      "unsigned_output": "target/iar-macos-vm-release/guest",
      "candidate_identity": "metadata-bound-but-unmaterialized"
    }
  ],
  "candidate_record_requirements": {
    "candidate_source_revision": "exact-git-commit-required",
    "candidate_source_archive_sha256": "required",
    "build_environment": ["macos_product_version", "macos_build_version", "xcode_version", "xcode_build_version", "apple_sdk_version", "swift_version", "rustc_verbose_version", "cargo_version", "target_triple"],
    "per_artifact": ["unit_id", "bundle_path", "bytes", "sha256", "file_format", "architectures", "unsigned", "build_log_sha256"],
    "product_evidence": ["spdx_2_3_sbom_sha256", "license_inventory_sha256", "vulnerability_assessment_sha256", "reproducibility_disposition_sha256"],
    "guest_evidence": ["guest_release_id", "guest_metadata_set_digest", "guest_metadata_seal_digest"],
    "compound_identity_canonicalization": "candidate-source-revision-tab-product-version-tab-sorted-bundle-path-bytes-sha256-lf-then-sha256-v1",
    "all_fields_required_before_substitution": true
  },
  "rollback": {
    "application_predecessor": "none-first-cask-release",
    "guest_predecessor_release_id": "iar-macos-local-vm-guest-2026-08-30.1",
    "whole_bundle_only": true,
    "mixed_version_rollback": false
  },
  "controls": {
    "contract_frozen": true,
    "offline_validation": true,
    "repository_build_input_metadata_read": true,
    "workspace_scanned": false,
    "network_access": false,
    "credential_access": false,
    "process_launch": false,
    "candidate_materialized": false,
    "release_bundle_assembled": false,
    "archive_created": false,
    "bundle_installed": false,
    "cask_created": false,
    "release_identity_bound": false,
    "developer_id_signature_verified": false,
    "apple_notarization_verified": false,
    "github_publication_attestation_verified": false,
    "cask_lifecycle_verified": false,
    "sealed_distribution": false,
    "vm_launch": false,
    "analyzer_execution": false,
    "production_admitted": false,
    "macos_iar_1b_admitted": false,
    "authority_added": false
  }
}
